category,brand,title,type,price,available,available_status,sold,country,last_updated,price_segment,estimated_revenue
men,Llure Sx,LLURE SX HUMAN PHERAMONES #1 FRAGRANCE FOR MEN TO ATTRACT BEAUTIFUL WOMEN,Cologne,38.95,3.0,Available,114,United States,2024-05-15 11:26:06.000,Prezzo Medio,4440.3
men,Lomani,"Lomani EDT Cologne 3.4 oz Men - Authentic, Brand New In Box",Eau de Toilette,9.99,2.0,Available,22,United States,2024-05-20 13:20:54.000,Prezzo Basso,219.78
men,Ebc,Long Lasting Fire Cologne for Men (Inspired by Fahrenheit) 3.4oz/100ml,Cologne,13.5,10.0,Available,17,United States,2024-05-09 17:47:19.000,Prezzo Basso,229.5
men,Giorgio Armani,Lot of 12 - Acqua Di Gio Profondo - Men's Luxury Cologne Samples - EDP - Armani,Eau de Parfum,24.0,3.0,Available,2,United States,,Prezzo Basso,48.0
men,Louis Vuitton,Louis Vuitton Imagination Eau De Parfum Sample Spray - 2ml/0.06oz,Eau de Parfum,21.95,10.0,Available,448,United States,2024-05-23 22:35:31.000,Prezzo Basso,9833.6
men,Louis Vuitton,Louis Vuitton Meteore Eau de Parfum Sample Spray - 2ml/0.06oz,Eau de Parfum,18.95,10.0,Available,624,United States,2024-05-15 17:19:08.000,Prezzo Basso,11824.8
men,Louis Vuitton,Louis Vuitton Ombre Nomade Eau De Parfum Sample Spray - 2ml/0.06oz,Eau de Parfum,22.95,9.0,Available,647,United States,2024-04-21 21:21:42.000,Prezzo Basso,14848.65
men,,Love Bombed Pheromone Cologne for- Men Enhanced Scents Pheromone Perfume,Parfum,13.28,9.0,Available,6,United States,,Prezzo Basso,79.67999999999999
men,Lucianno,Lucianno California Vibe M 100ml Boxed,Parfum,66.0,10.0,Available,21,Canada,2024-05-24 02:33:19.000,Prezzo Medio,1386.0
men,Luxury,Luxury by New Brand cologne for men EDT 3.3 /3.4 oz New In Box,Eau de Toilette,10.67,57.0,Available,272,United States,2024-05-24 01:20:13.000,Prezzo Basso,2902.24
men,Bath & Body Works,MAHOGANY TEAKWOOD Cologne 3.4oz Spray Collection Bath and & Body Works Ne 2024,Cologne,35.68,9.0,Available,12,United States,,Prezzo Medio,428.15999999999997
men,Maison Alhambra,Maison Alhambra Men's Salvo Intense EDP 3.4 oz Fragrances 6291108733486,Other,19.73,3.0,Available,18,United States,2024-05-24 05:44:31.000,Prezzo Basso,355.14
men,Maison Alhambra,Maison Alhambra Men's Victorioso Victory EDP Spray 3.4 oz Fragrances,Other,19.73,,Unknown,55,United States,2024-05-24 07:02:34.000,Prezzo Basso,1085.15
men,Maison Francis Kurkdjian,Maison Francis Kurkdjian Amyris Homme 2.4oz Eau de Toilette,Eau de Toilette,140.0,24.0,Available,6,United States,2024-05-20 12:54:11.000,Prezzo Alto,840.0
men,Maison Francis Kurkdjian,Maison Francis Kurkdjian Amyris Pour Homme Eau de Toilette 2.4 Fl Oz,,159.99,4.0,Available,2,United States,2024-05-17 11:43:56.000,Prezzo Alto,319.98
men,,Male Eau De TOILETTE 3.4 oz / 100 ml EDT Spray For Men New In Seald Box USA,Eau de Toilette,49.99,5.0,Available,24,Hong Kong,2024-05-22 17:27:49.000,Prezzo Medio,1199.76
men,Mancera,MANCERA COSMIC PEPPER EDP 2.0ml .06fl oz x 1 COLOGNE SPRAY SAMPLE,Eau de Parfum,13.5,10.0,Available,17,United States,2024-04-01 21:47:48.000,Prezzo Basso,229.5
men,Mandarin Duck,Mandarina Duck Black 3.4oz EDT Spray For Men New Choose Your Box (Regular/TSTR),Eau de Toilette,27.99,10.0,Available,75,United States,2022-11-02 03:03:01.000,Prezzo Basso,2099.25
men,,Mans Sauvage Eau de Toilette 3.4 Oz 100ml Parfum Spray Brand New Sealed In box,Eau de Toilette,48.99,10.0,Available,101,Hong Kong,2024-05-20 17:37:45.000,Prezzo Medio,4947.99
men,Tommy Bahama,Maritime Deep Blue by Tommy Bahama 4.2 oz Cologne for Men New in Box,Cologne,32.62,10.0,Available,242,United States,2024-05-23 09:27:28.000,Prezzo Medio,7894.039999999999
men,Mary Kay,Mary Kay Domain Men’s Cologne,Cologne,30.0,2.0,Available,24,United States,2024-05-08 08:37:11.000,Prezzo Medio,720.0
men,Xerjoff,Mefisto Gentiluomo by Xerjoff EDP for Men 2ml Vial Spray New Factory Sealed,Eau de Parfum,11.0,3.0,Available,47,United States,2024-05-16 15:22:05.000,Prezzo Basso,517.0
men,United Scents,Men's  Perfume Black Intense 3.4 Fl Oz Parfum Fragrance,Eau de Parfum,14.99,10.0,Available,20,United States,2024-05-18 15:52:35.000,Prezzo Basso,299.8
men,Assorted,Men's Cologne Sample Spray Vials - Choose Scent Combined Shipping,Eau de Parfum,3.5,4.0,Available,3009,United States,2024-05-23 09:24:03.000,Prezzo Basso,10531.5
men,As Showed,Men's Fahrenheit Eau De Toilette Cologne Spray 3.4oz / 100 ML New in Box Sealed,Eau de Toilette,9.61,,Unknown,17,Hong Kong,2024-05-20 19:45:54.000,Prezzo Basso,163.37
men,,Men's Perfume-Cupid Hypnosis Pheromone-Infused Cologne Fragrances Charm Toilette,Parfum,15.99,10.0,Available,136,United States,2024-05-23 14:39:34.000,Prezzo Basso,2174.64
men,Secertmu,Men's Perfume Pheromone- Infused Cupid Hypnosis Cologne Fragrances Charm Spray！,Other,12.99,10.0,Available,10,United States,2024-05-21 19:32:52.000,Prezzo Basso,129.9
men,Multiple Brands,Men's Perfume Sampler 10pcs Sample Vials Designer Fragrance Samples for Men,Parfum,14.99,10.0,Available,79,United States,2024-05-23 06:57:41.000,Prezzo Basso,1184.21
men,,Men's Pheromone-Infused Perfume-Cupid Hypnosis Cologne Fragrances Charm Toilette,Parfum,15.99,10.0,Available,45,United States,2024-05-23 19:54:34.000,Prezzo Basso,719.55
men,,Men's Pheromone-Infused Perfume Cupid Hypnosis Cologne Fragrances Charm Toilette,Parfum,15.99,10.0,Available,65,United States,2024-05-22 14:08:35.000,Prezzo Basso,1039.35
men,,Men's Pheromone-Infused Perfume Cupid Hypnosis Cologne Fragrances Charm Toilette,Parfum,49.99,10.0,Available,45,United States,2024-05-21 16:11:07.000,Prezzo Medio,2249.55
men,Ralph Lauren,Men Polo Deep Blue by Ralph Lauren 4.2 oz Parfum Cologne New In Box,Eau de Parfum,53.99,2.0,Available,16,United States,2024-05-20 01:23:56.000,Prezzo Medio,863.84
men,,Mens Cologne 3.4oz Y Perfume Eau De Parfum 100ml Spray for Men New In Box,Eau de Parfum,49.99,8.0,Available,25,Hong Kong,2024-05-24 00:24:35.000,Prezzo Medio,1249.75
men,As Showed,Mens Fahrenheit Eau De Toilette Cologne Spray 3.4 fl.oz 100 ML New in Box Sealed,Eau de Toilette,43.47,10.0,Available,34,Hong Kong,2024-05-12 17:40:33.000,Prezzo Medio,1477.98
men,Mercedes-Benz,Mercedes-Benz Men's Mercedes-Benz Club Black EDT 3.4 oz Fragrances 3595471041197,Eau de Toilette,49.81,3.0,Available,15,United States,2024-05-22 20:56:36.000,Prezzo Medio,747.1500000000001
men,Mercedes-Benz,Mercedes Benz Club Black Eau de Toilette for Men 1.7 Oz / 50ml,Eau de Toilette,38.99,33.0,Available,7,United States,2024-05-20 17:45:18.000,Prezzo Medio,272.93
men,Mercedes-Benz,MERCEDES BENZ CLUB BLACK EDT 3.4 OZ / 100 ML FOR MEN (NEW IN WHITE BOX),Eau de Toilette,37.99,4.0,Available,2,United States,2024-05-22 22:37:03.000,Prezzo Medio,75.98
men,Mercedes Benz,"Mercedes Benz Intense by Mercedes Benz, 4 oz EDT Spray for Men",Eau de Toilette,41.87,8.0,Available,21,United States,2024-05-23 08:57:02.000,Prezzo Medio,879.27
men,Mercedes-Benz,Mercedez Benz Club Black 3.3 oz EDT Spray Mens Cologne 100ml NIB,Eau de Toilette,47.99,10.0,Available,17,United States,2024-05-16 21:53:55.000,Prezzo Medio,815.83
men,Michael Jordan,Michael Jordan by Michael Jordan 3.4 oz Cologne Spray for Men New In Box,Cologne,20.48,,Unknown,2624,United States,2024-05-22 21:41:09.000,Prezzo Basso,53739.520000000004
men,Michael Jordan,Michael Jordan Legend by Michael Jordan 3.4 oz Cologne Spray for Men New In Box,Cologne,21.79,10.0,Available,488,United States,2024-05-24 10:03:02.000,Prezzo Basso,10633.52
men,Michael Malul London,Michael Malul Ocean Noir 3.4 oz / 100 ml eau de parfum for men Spray New,Eau de Parfum,90.11,10.0,Available,51,United States,2024-05-11 09:30:33.000,Prezzo Alto,4595.61
men,Versace,mini cologne Versace Pour Homme for Men Brand New In Box,Eau de Toilette,8.84,10.0,Available,9410,United States,2024-05-23 09:06:49.000,Prezzo Basso,83184.4
men,Hermes,mini Terre D'Hermes by Hermes 0.17 oz EDT Cologne for Men Brand New In Box,Eau de Toilette,14.98,10.0,Available,418,United States,2024-05-24 09:36:53.000,Prezzo Basso,6261.64
men,Missoni,Missoni Men's Pour Homme EDP Spray 3.4 oz (Tester) Fragrances 8011003841431,Other,30.07,3.0,Available,12,United States,2024-05-23 20:20:19.000,Prezzo Medio,360.84000000000003
men,Montblanc,Mont Blanc Explorer 6.7 oz EDP Cologne for Men New In Box,Eau de Parfum,62.08,,Unknown,950,United States,2024-05-22 06:00:02.000,Prezzo Medio,58976.0
men,Montblanc,MONT BLANC LEGEND 3.3 / 3.4 oz EDT Cologne for Men New In Box,Eau de Toilette,32.89,383.0,Available,5032,United States,2024-05-21 07:59:07.000,Prezzo Medio,165502.48
men,Mont Blanc,Mont Blanc Legend by Mont Blanc cologne for men EDP 3.3 / 3.4 oz New In Box,Eau de Parfum,36.81,207.0,Available,1234,United States,2024-05-24 09:22:44.000,Prezzo Medio,45423.54
men,Montblanc,Mont Blanc Legend Spirit 6.7 oz EDT Cologne for Men New In Box,Eau de Toilette,52.62,,Unknown,5098,United States,2024-05-24 10:18:05.000,Prezzo Medio,268256.76
men,Mont Blanc Legend,MONT BLANC LEGEND SPIRIT EDT 3.3 OZ FOR MEN WITH CAP NEW IN WHITE BOX,Eau de Toilette,33.5,,Unknown,1511,United States,2024-05-22 16:32:56.000,Prezzo Medio,50618.5
men,Montblanc,Montblanc Legend Spirit / MontBlanc EDT Spray 3.3 oz (100 ml) (m),Other,35.71,3.0,Available,30,United States,2024-05-24 06:08:29.000,Prezzo Medio,1071.3
men,Montblanc,MontBlanc Men's Starwalker EDT Spray 2.5 oz Fragrances 3386460028486 (Tester),Other,31.29,3.0,Available,1,United States,2024-05-20 16:10:31.000,Prezzo Medio,31.29
men,Superz Budapest,MOROCCO BY SUPERZ BUDAPEST 50ML/ 1.69 OZ EXTRAIT DE PARFUM USA SELLER,Parfum,125.0,10.0,Available,28,United States,2024-05-23 19:49:00.000,Prezzo Alto,3500.0
men,Moschino,"MOSCHINO Toy Boy Eau De Parfum for Men, 3.4 US fl. oz. / 100 ml",Eau de Parfum,29.99,5.0,Available,17,United States,2024-05-24 00:58:38.000,Prezzo Basso,509.83
men,Thierry Mugler,Mugler Cologne Come Together by Thierry Mugler 3.3 oz EDT Spray in Sealed Box,Eau de Toilette,59.99,10.0,Available,221,United States,2024-05-23 21:56:49.000,Prezzo Medio,13257.79
men,Nautica,NAUTICA BLUE by Nautica 3.4 oz / 100 ml Eau De Toilette Spray NEW & SEALED,Eau de Toilette,14.99,3.0,Available,291,United States,2024-05-23 10:21:16.000,Prezzo Basso,4362.09
men,Nautica,NAUTICA VOYAGE cologne for men EDT 6.7 oz 6.8 New in Box,Eau de Toilette,33.45,127.0,Available,1391,United States,2024-05-23 03:25:35.000,Prezzo Medio,46528.950000000004
men,Nautica,Nautica Voyage Heritage by Nautica 3.4 oz EDT Cologne for Men New In Box,Eau de Toilette,18.33,10.0,Available,1332,United States,2024-05-22 09:47:13.000,Prezzo Basso,24415.559999999998
men,Nautica,Nautica Voyage Men's EDT 3.4 oz Cologne Spray New in Box,Eau de Toilette,17.99,3.0,Available,324,United States,2024-05-20 10:32:37.000,Prezzo Basso,5828.759999999999
men,Xerjoff,Naxos By Xerjoff Vial Spray 2ml New Sealed,Eau de Parfum,11.99,4.0,Available,442,United States,2024-05-22 00:57:56.000,Prezzo Basso,5299.58
men,Ralph Lauren,New & Sealed! Polo Black by Ralph Lauren 2.5 oz Cologne for Men 7D,Eau de Toilette,22.5,10.0,Available,2,United States,,Prezzo Basso,45.0
men,Cologne,New 10x New Random Unique Men's Fragrance Cologne Sample Set Christimas Gift Set,Parfum,19.9,,Unknown,331,United States,2023-11-21 08:32:55.000,Prezzo Basso,6586.9
men,Secertmu,New 2024 Sexy Cologne Cupid Hypnosis Long Lasting Pheromone Perfume for Men,Parfum,6.96,10.0,Available,102,United States,2024-05-18 16:15:46.000,Prezzo Basso,709.92
men,Secertmu,New 2024 Sexy Cologne Cupid Hypnosis Long Lasting Pheromone Perfume for Men,Parfum,6.97,10.0,Available,803,United States,2024-05-21 19:20:13.000,Prezzo Basso,5596.91
men,Secertmu,New 2024 Sexy Cologne Cupid Hypnosis Long Lasting Pheromone Perfume for Men,Parfum,15.99,10.0,Available,889,United States,2024-05-21 19:20:12.000,Prezzo Basso,14215.11
men,,New 2024 Sexy Cologne Cupid Hypnosis Long Lasting Pheromone Perfume for Men US,Other,10.99,10.0,Available,38,United States,2024-05-20 23:42:53.000,Prezzo Basso,417.62
men,Secertmu,New 2024 Sexy Cologne Cupid Hypnosis Long Lasting Pheromone Perfume for Men US,Parfum,13.99,10.0,Available,290,United States,2024-05-21 19:21:49.000,Prezzo Basso,4057.1
men,Secertmu,New 2024 Sexy Cologne Cupid Hypnosis Long Lasting Pheromone Perfume for Men US !,Parfum,7.96,10.0,Available,38,United States,2024-02-22 02:08:53.000,Prezzo Basso,302.48
men,Secertmu,New 2024 Sexy Cologne Lure Her Him Long Lasting Pheromone Perfume for Men USA,Parfum,10.99,10.0,Available,35,United States,2024-05-18 14:48:44.000,Prezzo Basso,384.65000000000003
men,Cologne,NEW BLEU PARFUM de Blue for Men 3.4oz / 100ml EAU DE Cologne Spray IN BOX,Parfum,88.0,5.0,Available,5,United States,2024-05-23 22:52:22.000,Prezzo Alto,440.0
men,Bvlgari,New Bvlgari Pour Homme Men's Eau De Toilette Spray 3.4 oz/ 100 ml,Eau de Toilette,45.68,10.0,Available,5,United States,2024-05-22 19:40:47.000,Prezzo Medio,228.4
men,As Photos,New Carolina-Herrera 212 NYC Men Eau De Toilette 3.4 oz/ 100 ml,Eau de Toilette,34.68,8.0,Available,2,United States,,Prezzo Medio,69.36
men,Fm,New Frederic Malle CARNAL FLOWER Dominique Ropion MINI Travel Spray .12oz/3.5ml,Parfum,16.85,4.0,Available,16,United States,2024-05-20 06:43:11.000,Prezzo Basso,269.6
men,Giorgio Armani,New Giorgio Armani Acqua Di Gio 3.4 oz Men's Eau de Toilette Spray IN BOX US1,Eau de Toilette,28.99,9.0,Available,111,United States,2024-05-24 00:02:00.000,Prezzo Basso,3217.89
men,Creed,New In Box Eau De Parfum Aventus 3.3 /OZ 100 ML Spray For men,Eau de Parfum,189.99,2.0,Available,32,United States,2024-05-24 04:22:27.000,Prezzo Alto,6079.68
men,Moschino,New in Box Men's Perfume Toy Boy by Moschino Eau De Parfum EDP Spray 3.4oz/100ml,Eau de Parfum,34.99,9.0,Available,3,United States,2024-05-21 19:21:40.000,Prezzo Medio,104.97
men,Bvlgari,NEW Men's EDT Bvlgari Pour Homme Eau De Toilette Spray 3.4 fl oz Sealed in Box,Eau de Toilette,45.69,8.0,Available,31,China,2024-05-15 03:14:10.000,Prezzo Medio,1416.3899999999999
men,Parfums De Marly,New Parfums de Marly Kalan by Parfums de Marly 4.2 oz EDP Spray for Men Cologne,Eau de Parfum,82.99,3.0,Available,5,United States,2024-05-22 19:16:28.000,Prezzo Alto,414.95
men,Tom Ford,"New TOM FORD GREY VETIVER Parfum Sample Spray .05oz, 1.5ml",Parfum,13.05,3.0,Available,9,United States,2024-05-15 19:24:33.000,Prezzo Basso,117.45
men,Gianni Versace,"NEW Versace Eros , Gianni Versace 6.7oz 200ml EDT Cologne for Men SEALED GENUINE",Eau de Toilette,69.25,3.0,Available,19,United States,2024-05-22 04:50:01.000,Prezzo Medio,1315.75
men,Bond No. 9,New York Nights Bond No 9 Made Stronger With Pheromones For Super Sexual Allure!,Eau de Parfum,17.98,10.0,Available,9,United States,2024-05-16 12:30:59.000,Prezzo Basso,161.82
men,Yves Saint Laurent,New Yves Saint Laurent Y Intense Eau De Parfum EDP Spray for Men 3.3 oz/100 ml,Eau de Parfum,46.48,8.0,Available,7,China,2024-05-24 01:20:40.000,Prezzo Medio,325.35999999999996
men,Yves Saint Laurent,NIB YSL Yves Saint Laurent MYSLF EDP Spray 3ml / 0.1oz MYSELF NEW FOR 2023,Eau de Parfum,15.99,6.0,Available,91,United States,2024-05-11 09:37:04.000,Prezzo Basso,1455.09
men,Armaf,Nomad The Wanderer by Armaf cologne for men EDP 3.3 / 3.4 oz New in Box,Eau de Parfum,36.95,36.0,Available,109,United States,2024-05-16 09:13:23.000,Prezzo Medio,4027.55
men,Calvin Klein,OBSESSION by Calvin Klein 4.0 oz 4 MEN edt Cologne New in Box,Eau de Toilette,23.56,,Unknown,24048,United States,2024-05-23 08:46:31.000,Prezzo Basso,566570.88
men,Calvin Klein,Obsession by Calvin Klein for Men 3.4 oz After Shave Balm in Tube Full Size NEW,Other,17.99,3.0,Available,3,United States,2024-05-23 18:43:56.000,Prezzo Basso,53.97
men,Calvin Klein,Obsession Night by CK Calvin Klein 4.0 oz EDT Cologne for Men New In Box,Eau de Toilette,28.02,,Unknown,5377,United States,2024-05-23 00:47:54.000,Prezzo Basso,150663.54
men,Bath & Body Works,OCEAN Cologne Bath & Body Works 3.4 Oz 100 ml Spray Men's Collection Ne,Cologne,28.95,,Unknown,5,United States,,Prezzo Basso,144.75
men,Prada,OCEAN LUNA ROSSA by Prada Eau de Toilette Carded Sample for MEN .04oz/1.2ml,Eau de Toilette,8.88,10.0,Available,21,United States,2024-04-12 08:49:37.000,Prezzo Basso,186.48000000000002
men,Michael Malul London,Ocean Noir EDP Perfume By Michael Malul 100 ML (Eau De Parfum) (For Men),Eau de Parfum,89.99,4.0,Available,8,United States,2024-05-12 20:22:40.000,Prezzo Alto,719.92
men,Armaf,Odyssey Aoud Edition by Armaf 3.4 oz EDP Cologne for Men New In Box,Eau de Parfum,29.03,2.0,Available,11,United States,2024-05-23 01:07:01.000,Prezzo Basso,319.33000000000004
men,Armaf,Odyssey Homme by Armaf 6.7 / 6.8 oz EDP Cologne for Men New in Box,Eau de Parfum,36.95,19.0,Available,120,United States,2024-05-20 21:16:42.000,Prezzo Medio,4434.0
men,Armaf,Odyssey Mandarin Sky Limited Edition EDP Perfume By Armaf 100MLTop Fragrance,Eau de Parfum,45.0,10.0,Available,150,United States,2024-05-15 15:14:22.000,Prezzo Medio,6750.0
men,Fragance One,Office For Men Fragrance One By Jeremy Fragrance 100ml - 3.3oz 3.4oz NEW $250,Eau de Parfum,179.99,5.0,Available,5,United States,2024-05-21 01:44:29.000,Prezzo Alto,899.95
men,Old Spice,"Old Spice Cologne Spray for Men,Classic Scent,4.25 fl oz Free Shipping Pack Of 2",Cologne,19.99,2.0,Available,132,United States,2024-05-23 17:38:31.000,Prezzo Basso,2638.68
men,Jacques Bogart,ONE MAN SHOW HIGHLY CONCENTRATED by Jacques Bogart Cologne 3.3 / 3.4 oz NEW IN B,Eau de Toilette,13.97,31.0,Available,957,United States,2024-05-11 23:42:49.000,Prezzo Basso,13369.29
men,Paco Rabanne,One Million Golden Oud Parfum Intense By Paco Rabanne Sample 1.5ml New Release,Parfum,11.95,10.0,Available,18,United States,2024-05-08 03:13:17.000,Prezzo Basso,215.1
men,Paco Rabanne,One Million Royal by Paco Rabanne 1 Million Royal Cologne for Men 3.4 oz,Eau de Parfum,74.99,2.0,Available,60,Hong Kong,2024-05-23 02:25:57.000,Prezzo Medio,4499.4
men,Lattafa,Opulent Oud by Lattafa 3.4 oz EDP Cologne for Men New in Box,Eau de Parfum,16.9,10.0,Available,127,United States,2024-05-21 08:40:15.000,Prezzo Basso,2146.2999999999997
men,Mancera,Original MANCERA CEDRAT BOISE 4 oz (120 ml) EDP Spray NEW & SEALED,Eau de Parfum,69.97,8.0,Available,30,United States,2024-05-22 09:17:29.000,Prezzo Medio,2099.1
men,Afnan,Ornament pour homme by Afnan Cologne For Men EDP 3.3 / 3.4 oz New in Box,Eau de Parfum,22.15,28.0,Available,196,United States,2024-05-23 06:45:23.000,Prezzo Basso,4341.4
men,English Laundry,"Oxford Bleu by English Laundry, 3.4 oz EDP Spray for Men",Eau de Parfum,36.67,10.0,Available,169,United States,2024-05-24 07:58:46.000,Prezzo Medio,6197.2300000000005
men,Brut,Brut Original EDT Cologne for Men 3.4 oz Brand New In Box,Eau de Toilette,13.89,9.0,Available,48,United States,2024-05-22 11:57:53.000,Prezzo Basso,666.72
men,Paco Rabanne,Paco Rabanne 1 Million 3.4 oz Men's EDT Bold Signature Scent New,Eau de Toilette,49.99,5.0,Available,21,United States,2024-05-18 08:34:44.000,Prezzo Medio,1049.79
men,Paco Rabanne,Paco Rabanne 1 Million Men's Fragrance EDT Cologne 3.4 oz 100 ml New in Box,Eau de Toilette,49.99,10.0,Available,165,United States,2024-05-24 09:52:03.000,Prezzo Medio,8248.35
men,Paco Rabanne,Paco Rabanne 1 Million Royal Parfum 3.4 oz Cologne for Men New In Box,Eau de Parfum,74.99,10.0,Available,23,Hong Kong,2024-05-23 17:37:22.000,Prezzo Medio,1724.77
men,Paco Rabanne,Paco Rabanne 1 One Million Lucky Eau De Toilette 6.8 oz / 200 ml For Men,Eau de Toilette,135.0,8.0,Available,4,United States,,Prezzo Alto,540.0
men,Paco Rabanne,Paco Rabanne Invictus 3.4 oz EDT Sporty Men's Cologne Energizing Scent Sealed,Eau de Toilette,39.99,10.0,Available,118,United States,2024-05-17 10:37:39.000,Prezzo Medio,4718.820000000001
men,Paco Rabanne,Paco Rabanne Invictus 3.4 oz EDT Sporty Men's Fragrance Heroic Scent,Eau de Toilette,39.99,5.0,Available,23,United States,2024-05-13 11:37:20.000,Prezzo Medio,919.7700000000001
men,Paco Rabanne,Paco Rabanne Invictus 3.4oz Eau de Toilette Men's Cologne Sealed,Eau de Toilette,39.99,10.0,Available,16,United States,2024-05-23 08:37:31.000,Prezzo Medio,639.84
men,Paco Rabanne,Paco Rabanne Invictus Cologne EDT 3.4oz Sealed Victory Scent Power,Eau de Toilette,39.99,10.0,Available,5,United States,2024-05-24 07:13:32.000,Prezzo Medio,199.95000000000002
men,Paco Rabanne,Paco Rabanne Invictus EDT 3.4 oz | Men's Cologne,Eau de Toilette,39.99,3.0,Available,3,United States,2024-05-08 14:29:55.000,Prezzo Medio,119.97
men,Paco Rabanne,"Paco Rabanne Invictus EDT 3.4oz for Men - Sealed, Sporty Fragrance",Eau de Toilette,39.99,7.0,Available,40,United States,2024-05-19 10:33:07.000,Prezzo Medio,1599.6000000000001
men,Paco Rabanne,Paco Rabanne Invictus Legend 100ml / 3.4 oz (Tester) Eau De Parfum Spray for Men,Eau de Parfum,104.99,5.0,Available,38,United States,2024-05-22 16:48:50.000,Prezzo Alto,3989.62
men,Paco Rabanne,Paco Rabanne Invictus Legend 5.1 FL OZ / 150 ML EAU DE PARFUM SPRAY - RARE ITEM,Eau de Parfum,140.0,,Unknown,2,United States,,Prezzo Alto,280.0
men,Paco Rabanne,Paco Rabanne Men's 1 Million Royal Parfum Spray 1.7 oz Fragrances 3349668617043,Other,68.61,3.0,Available,10,United States,2024-05-23 13:26:47.000,Prezzo Medio,686.1
men,Paco Rabanne,Paco Rabanne Men's Ultrared EDT Spray 3.4 oz Fragrances 3349666005972,Eau de Toilette,36.65,3.0,Available,11,United States,2024-05-23 10:20:53.000,Prezzo Medio,403.15
men,Paco Rabanne,"Paco Rabanne One Million - Distinct 3.4oz Men's EDT Cologne, Sealed",Eau de Toilette,50.99,6.0,Available,15,United States,2024-05-23 11:00:52.000,Prezzo Medio,764.85
men,Paco Rabanne,Paco Rabanne PHANTOM 100ml / 3.4 oz EDP INTENSE Sealed Authentic Fast Finescents,Eau de Parfum,108.0,,Unknown,10,United States,2024-05-23 10:26:22.000,Prezzo Alto,1080.0
men,Cologne,PACO RABANNE Phantom Parfum 0.17oz/5mL Mens - Mini Size Cologne - New In Box!,Eau de Parfum,24.99,,Unknown,2,United States,,Prezzo Basso,49.98
men,Paco Rabanne,Paco Rabanne PHANTOM Parfum 1.7 oz / 50 ml Men's Spray,Parfum,82.99,10.0,Available,2,United States,2024-05-22 01:08:01.000,Prezzo Alto,165.98
men,Paco Rabanne,Paco Rabanne Pour Homme  men 1 oz EDT U/B,Eau de Toilette,18.99,10.0,Available,38,United States,2024-05-01 11:40:14.000,Prezzo Basso,721.6199999999999
men,Paco Rabanne,PACO RABANNE pour homme Cologne for Men EDT  3.3 / 3.4 oz New Tester,Eau de Toilette,28.93,44.0,Available,4764,United States,2024-05-22 11:37:19.000,Prezzo Basso,137822.52
men,Paco Rabanne,Paco Rabanne Pure XS Night 3.4 oz 100 ml EDP  Spray in white box. Discontinued.,Eau de Parfum,69.99,10.0,Available,13,United States,2024-02-28 07:26:54.000,Prezzo Medio,909.8699999999999
men,Mirage Brands,Parfum Azure Noir Intense Men's Cologne 3.4 Oz EDT Perfume Long Lasting,Eau de Toilette,13.68,10.0,Available,105,United States,2024-05-06 16:50:06.000,Prezzo Basso,1436.3999999999999
men,Cologne,Parfum For men sauvage cologne Eau De perfum 100ml fl 3.4oz,Parfum,68.89,4.0,Available,25,United States,2024-05-24 09:37:13.000,Prezzo Medio,1722.25
men,,Parfums De-Marly-Haltane Eau de Parfum spray 4.2 oz for Men New in Box,Eau de Parfum,85.0,,Unknown,6,United States,2024-05-24 00:10:39.000,Prezzo Alto,510.0
men,Parfums De Marly,Parfums de Marly Kalan 4.2 fl oz / 125 ml Spray with box Men's Fragrances,Eau de Parfum,110.0,,Unknown,6,United States,2024-05-21 06:39:59.000,Prezzo Alto,660.0
men,Parfums De Marly,"Parfums de Marly Layton by Parfums de Marly, 2.5 oz EDP Spray men",Eau de Parfum,155.65,10.0,Available,593,United States,2024-05-24 07:56:19.000,Prezzo Alto,92300.45
men,Parfums De Marly,Parfums De Marly Layton Exclusif Eau de Parfum Sample Spray 1.5ml / 0.05oz,Eau de Parfum,13.95,7.0,Available,41,United States,2024-05-16 02:46:25.000,Prezzo Basso,571.9499999999999
men,Parfums De Marly,Parfums de Marly LAYTON Royal Essence EDP Spray 4.2 fl oz. NEW Sealed Box,Eau de Parfum,91.98,,Unknown,7,United States,2024-05-23 14:18:39.000,Prezzo Alto,643.86
men,Paris Hilton,PARIS HILTON edt Cologne Spray 3.4 oz 3.3 Men New in RETAIL Box,Eau de Toilette,25.49,16.0,Available,2093,United States,2024-05-13 19:01:09.000,Prezzo Basso,53350.57
men,Paul Sebastian,Paul Sebastian PS Cologne Spray 4.0 / 4 oz EDC For Men New tester,Cologne,17.12,310.0,Available,597,United States,2024-05-24 09:32:11.000,Prezzo Basso,10220.640000000001
men,Parfums De Marly,PDM PARFUMS DE MARLY LAYTON EXCLUSIF 1.5ml .05fl oz x 1 COLOGNE SPRAY SAMPLE,Parfum,12.0,10.0,Available,19,United States,,Prezzo Basso,228.0
men,Penhaligon'S,Penhaligon's The Omniscient Mister Thompson 2.5 oz/75 ml Eau de Parfum Spray New,Eau de Parfum,188.99,4.0,Available,1,Canada,2024-05-05 19:10:00.000,Prezzo Alto,188.99
men,Penhaligon'S,Penhaligon's The Tragedy of Lord George 2.5oz EDP Spray Men's Perfume,Eau de Parfum,99.99,,Unknown,30,United States,2024-05-20 04:16:27.000,Prezzo Alto,2999.7
men,,PERFUME Cologne for MEN Long Lasting Fragrance 100ML 3.4 Oz Gift Fast PARFUM,Eau de Toilette,13.86,10.0,Available,1146,United States,2024-05-24 08:52:14.000,Prezzo Basso,15883.56
men,Fc,PERFUME Cologne for MEN Long Lasting Fragrance 100ML 3.4 Oz PARFUM Best Gift,Parfum,14.7,10.0,Available,119,United States,2024-04-09 05:59:11.000,Prezzo Basso,1749.3
men,Fragrance Couture,Perfume for Men's Valentine Milano Cologne 3.4 Fl.oz EDT Best Gift Fast Shipping,Eau de Toilette,14.98,,Unknown,206,United States,2024-04-12 15:57:06.000,Prezzo Basso,3085.88
men,,Perfume For Men With Pheromones To Attract Women Fragrance Cologne Masculino,,16.34,5.0,Available,103,United States,2024-05-23 13:46:24.000,Prezzo Basso,1683.02
men,Hybrid & Company,Perfume Para Hombre Con Feromonas De Atraer Mujeres Fragancia Colonia Masculino*,Parfum,24.19,15.0,Available,73,United States,2024-05-09 08:15:16.000,Prezzo Basso,1765.8700000000001
men,Perry Ellis,"Perry Ellis 360 Red by Perry Ellis, 6.8 oz EDT Spray for Men",Eau de Toilette,40.72,10.0,Available,232,United States,2024-05-24 07:58:54.000,Prezzo Medio,9447.039999999999
