category,brand,title,type,price,available,available_status,sold,country,last_updated,price_segment,estimated_revenue
women,Lancôme,Idole by Lancome Eau de Parfum EDP Perfume for Women 2.5 oz New in Box,Eau de Parfum,44.98,10.0,Available,23,United States,2024-05-21 00:07:46.000,Prezzo Medio,1034.54
women,Lancôme,Idole by Lancome Eau de Parfum EDP Perfume for Women 2.5 oz New in Box,Eau de Parfum,49.99,10.0,Available,22,United States,2024-05-13 07:38:03.000,Prezzo Medio,1099.78
women,Lancôme,Idole by Lancome perfume for women EDP 1.7 oz New 50 ml,Eau de Parfum,36.99,8.0,Available,66,United States,2024-05-12 07:12:36.000,Prezzo Medio,2441.34
women,Jimmy Choo,ILLICIT FLOWER by Jimmy Choo for women EDT 3.3 / 3.4 oz New Tester,Eau de Toilette,25.23,8.0,Available,909,United States,2024-05-23 12:50:15.000,Prezzo Basso,22934.07
women,Kate Spade New York,In Full Bloom Blush by Kate Spade for Women - 3.4 oz EDP Spray (Tester),,14.4,5.0,Available,73,United States,2024-05-22 21:21:54.000,Prezzo Basso,1051.2
women,Salvatore Ferragamo,INCANTO CHARMS by Salvatore Ferragamo EDT 3.4 oz Perfume for women New in Box,Eau de Toilette,23.98,15.0,Available,1678,United States,2024-05-24 09:32:06.000,Prezzo Basso,40238.44
women,Salvatore Ferragamo,Incanto Charms by Salvatore Ferragamo for women EDT 3.3 / 3.4 oz New Tester,Eau de Toilette,17.79,15.0,Available,2177,United States,2024-02-20 08:37:01.000,Prezzo Basso,38728.83
women,Katy Perry,Indivisible by Katy Perry perfume for Women EDP 3.3 / 3.4 oz New In Box,Eau de Parfum,15.88,,Unknown,103,United States,2024-05-23 17:39:08.000,Prezzo Basso,1635.64
women,,J'adore 3.4 oz/100 ml Eau De Parfum EDP Women Spray Gift For Her New & Sealed,Eau de Parfum,78.99,10.0,Available,7,United States,2024-05-22 05:41:23.000,Prezzo Medio,552.93
women,,J'adore 3.4 oz/100 ml Eau De Parfum EDP Women Spray Gift For Her New & Sealed US,Eau de Parfum,49.99,8.0,Available,22,Hong Kong,2024-05-23 17:51:19.000,Prezzo Medio,1099.78
women,,J'adore Eau De Parfum  3.4 oz EDP Spray Gift For Women New Sealed 100 ml,Eau de Parfum,71.41,5.0,Available,27,Hong Kong,2024-05-20 07:43:07.000,Prezzo Medio,1928.07
women,,J'adore Eau De Parfum 3.4 oz / 100 ml Spray For Women New In Box,Eau de Parfum,59.99,10.0,Available,8,Hong Kong,2024-04-21 23:26:21.000,Prezzo Medio,479.92
women,,J'adore Eau De Parfum EDP 3.4oz/100ML Spray For Women Authentic Boxed Sealed,Eau de Parfum,49.99,10.0,Available,4,Hong Kong,2024-05-16 19:32:44.000,Prezzo Medio,199.96
women,,J'adore Parfum D'eau by Christian 3.4 oz EDP Fragrance for Women New In Box,Eau de Parfum,59.99,10.0,Available,9,Hong Kong,2024-05-23 01:23:05.000,Prezzo Medio,539.91
women,Jean Paul Gaultier,JEAN PAUL GAULTIER CLASSIQUE edt perfume spray 3.3 oz 3.4 Women NEW tester,Eau de Toilette,58.94,95.0,Available,129,United States,2024-05-23 08:46:38.000,Prezzo Medio,7603.259999999999
women,Jeanne Arthes,Jeanne Arthes Boum Candy Land Eau de Parfum Women Vanille Sa Pomme d'Amour 100ml,Eau de Parfum,29.66,10.0,Available,163,Bulgaria,2024-05-13 04:10:57.000,Prezzo Basso,4834.58
women,Lanvin,Jeanne Lanvin By Lanvin Paris Eau De Parfum Natural Spray 3.3 fl oz,Eau de Parfum,12.99,10.0,Available,43,United States,2024-04-29 08:20:31.000,Prezzo Basso,558.57
women,Jessica Mcclintock,Jessica Mc Clintock by Jessica McClintock 3.4 oz EDP Perfume for Women Tester,Eau de Parfum,20.93,,Unknown,1484,United States,2024-05-19 20:52:45.000,Prezzo Basso,31060.12
women,Jessica Mcclintock,Jessica McClintock Perfume 1.7 oz EDP For Women New In Box,Eau de Parfum,18.99,73.0,Available,886,United States,2024-05-22 22:59:15.000,Prezzo Basso,16825.14
women,J. Del Pozo,Jesus Del Pozo Halloween Perfume for Women 3.4 oz 3.3 Spray New in Box Sealed,Eau de Toilette,26.35,127.0,Available,984,United States,2024-05-24 09:11:08.000,Prezzo Basso,25928.4
women,Jimmy Choo,JIMMY CHOO BLOSSOM 3.3 / 3.4 oz EDP Perfume Women NEW TESTER,Eau de Parfum,31.14,25.0,Available,2503,United States,2024-05-24 08:05:06.000,Prezzo Medio,77943.42
women,Jimmy Choo,JIMMY CHOO by Jimmy Choo 3.3 / 3.4 oz EDP Women NEW IN BOX,Eau de Parfum,38.89,25.0,Available,1832,United States,2024-05-16 21:23:33.000,Prezzo Medio,71246.48
women,Jimmy Choo,JIMMY CHOO by Jimmy Choo 3.3 / 3.4 oz Spray EDT for Women NEW IN BOX,Eau de Toilette,33.52,131.0,Available,2846,United States,2024-05-21 11:29:33.000,Prezzo Medio,95397.92000000001
women,Jimmy Choo,JIMMY CHOO by Jimmy Choo 3.3 / 3.4 oz Spray EDT Perfume for Women Tester,Eau de Toilette,24.51,,Unknown,601,United States,2024-05-24 07:33:35.000,Prezzo Basso,14730.51
women,Jimmy Choo,JIMMY CHOO FLASH by Jimmy Choo 3.3 / 3.4 oz EDP Perfume Women NEW IN BOX,Eau de Parfum,37.02,25.0,Available,1926,United States,2024-05-24 08:52:07.000,Prezzo Medio,71300.52
women,Jimmy Choo,Jimmy Choo Illicit 2 oz EDP Perfume for Women New In Box,Eau de Parfum,28.18,10.0,Available,131,United States,2024-05-22 15:03:19.000,Prezzo Basso,3691.58
women,Jimmy Choo,JIMMY CHOO ILLICIT FLOWER by Jimmy Choo perfume EDT 3.3 / 3.4 oz New in Box,Eau de Toilette,34.43,16.0,Available,563,United States,2024-05-24 07:50:09.000,Prezzo Medio,19384.09
women,Jimmy Choo,Jimmy Choo Ladies I Want Choo Forever EDP Spray 3.38 oz (Tester) Fragrances,Eau de Parfum,49.81,3.0,Available,30,United States,2024-05-23 10:45:18.000,Prezzo Medio,1494.3000000000002
women,Jimmy Choo,Jimmy Choo Mini Set Gift Set Fragrances 3386460140898,Other,45.11,3.0,Available,15,United States,2024-05-23 05:10:19.000,Prezzo Medio,676.65
women,Jimmy Choo,Jimmy Choo Rose Passion By Jimmy Choo for her EDP 3.3 / 3.4 oz New Tester,Eau de Parfum,36.94,214.0,Available,30,United States,2024-05-15 01:11:01.000,Prezzo Medio,1108.1999999999998
women,Jo Malone,Jo Malone Amber & Patchouli Cologne Intense Spray Women's Eau de 3.4 fl oz/100ml,Cologne,86.99,6.0,Available,4,United States,2024-05-08 16:32:50.000,Prezzo Alto,347.96
women,Jo Malone,Jo Malone Basil & Neroli Cologne Spray Women's Eau de  - 3.4 fl oz/100ml,Cologne,79.99,7.0,Available,9,United States,2024-05-05 21:55:22.000,Prezzo Medio,719.91
women,Jo Malone,Jo Malone Bitter  Mandarin Cologne Spray Women's Eau de  - 3.4 fl oz/100ml,Cologne,79.99,9.0,Available,7,United States,2024-05-14 02:30:39.000,Prezzo Medio,559.93
women,Jo Malone,Jo Malone Dark Amber &Ginger Lily Cologne Intense Women's Eau de 3.4 fl oz/100ml,Cologne,79.99,6.0,Available,4,United States,2024-05-15 07:44:11.000,Prezzo Medio,319.96
women,Jo Malone,Jo Malone English Pear & Freesia 100ml/3.4fl oz Unisex Perfume Cologne Spray,Cologne,49.99,6.0,Available,117,Hong Kong,2024-05-20 17:32:38.000,Prezzo Medio,5848.83
women,Jo Malone,Jo Malone English Pear & Freesia 3.4oz Women's Eau de Cologne Spray,Cologne,66.95,10.0,Available,6,United States,2024-05-13 08:12:15.000,Prezzo Medio,401.70000000000005
women,Jo Malone,Jo Malone English Pear & Freesia Cologne EDC Perfume for Women With Sealed Box,Cologne,49.99,7.0,Available,122,Canada,2024-05-23 05:56:00.000,Prezzo Medio,6098.780000000001
women,Jo Malone,Jo Malone Incense & Cedrat Cologne Intense Spray Women's Eau de 3.4 fl oz/100ml,Cologne,76.99,9.0,Available,1,United States,2024-05-15 07:42:06.000,Prezzo Medio,76.99
women,Jo Malone,Jo Malone Lime Basil & Mandarin Cologne Spray Women's Eau de  - 3.4 fl oz/100ml,Cologne,79.99,8.0,Available,2,United States,2024-04-30 01:12:46.000,Prezzo Medio,159.98
women,Jo Malone,"Jo Malone London Cologne Spray ,Travel Size 9ml/0.3oz **Choose Your Scent** NEW",Cologne,16.98,10.0,Available,27,United States,2024-05-24 03:58:41.000,Prezzo Basso,458.46000000000004
women,Jo Malone,"Jo Malone London Cologne Spray ,Travel Size 9ml/0.3oz **Choose Your Scent** NEW",Cologne,17.0,5.0,Available,968,United States,2024-05-21 08:49:14.000,Prezzo Basso,16456.0
women,Jo Malone,Jo Malone London Cologne Spray Travel Size 9ml/0.3oz **Choose Your Scent** NEW,Cologne,15.98,10.0,Available,40,United States,2024-05-24 02:23:41.000,Prezzo Basso,639.2
women,Jo Malone,Jo Malone London English Pear & Sweet Pea Cologne travel size 9ml/0.3fl.oz NEW!!,Cologne,16.99,10.0,Available,39,United States,2024-05-19 11:41:14.000,Prezzo Basso,662.6099999999999
women,Jo Malone,"Jo Malone London English Pear & Sweet Pea Cologne, Large Size 3.4oz/100mL,NEW",Cologne,99.0,2.0,Available,2,United States,2024-05-01 07:26:19.000,Prezzo Alto,198.0
women,Jo Malone,Jo Malone London Grapefruit Cologne 3.4 oz,Parfum,73.99,7.0,Available,52,United States,2024-05-19 22:29:14.000,Prezzo Medio,3847.4799999999996
women,Jo Malone,Jo Malone Myrrh & Tonka Cologne Intense Spray Women's Eau de  - 3.4 fl oz/100ml,Cologne,95.99,10.0,Available,30,United States,2024-05-08 03:29:02.000,Prezzo Alto,2879.7
women,Jo Malone,Jo Malone Nectarine Blossom & Honey Cologne Women's Eau de  - 3.4 fl oz/100ml,Cologne,79.99,5.0,Available,5,United States,2024-04-30 01:12:46.000,Prezzo Medio,399.95
women,Jo Malone,Jo Malone Orange Blossom  Cologne Spray Women's Eau de  - 3.4 fl oz/100ml,Cologne,79.99,10.0,Available,15,United States,2024-04-30 01:12:45.000,Prezzo Medio,1199.85
women,Jo Malone,Jo Malone Orris & Sandalwood Cologne Intense Women's Eau de 3.4 fl oz/100ml,Cologne,86.99,4.0,Available,6,United States,2024-05-08 16:32:50.000,Prezzo Alto,521.9399999999999
women,Jo Malone,Jo Malone Oud & Bergamot Cologne Intense Spray Women's Eau de 3.4 fl oz/100ml,Cologne,86.99,7.0,Available,9,United States,2024-05-24 08:55:12.000,Prezzo Alto,782.91
women,Jo Malone,Jo Malone Peony & Blush Suede Cologne Spray Women's Eau de  - 3.4 fl oz/100ml,Cologne,79.99,9.0,Available,1,United States,2024-04-30 01:12:45.000,Prezzo Medio,79.99
women,Love Luxe Beauty,Kuromi  Perfume,Parfum,15.0,4.0,Available,1,United States,,Prezzo Basso,15.0
women,Jo Malone,Jo Malone Peony & Blush Suede Eau de Cologne 3.4Fl Oz / 100 ML Perfume,Parfum,49.99,9.0,Available,13,China,2024-05-21 20:04:49.000,Prezzo Medio,649.87
women,Jo Malone,Jo Malone Perfume Sample Vials 1.5ml - Choose Your Scent Combined Shipping,Cologne,4.95,10.0,Available,3954,United States,2024-05-16 02:57:23.000,Prezzo Basso,19572.3
women,Jo Malone,Jo Malone Red Roses Cologne Intense Spray Women's Eau de  - 3.4 fl oz/100ml,Cologne,79.99,4.0,Available,6,United States,,Prezzo Medio,479.93999999999994
women,Jo Malone,Jo Malone Saffron Cologne Intense Spray Women's Eau de 3.4 fl oz/100ml,Cologne,86.99,5.0,Available,5,United States,2024-05-08 16:32:50.000,Prezzo Alto,434.95
women,Jo Malone,Jo Malone Tuberose Angelica Cologne Intense Women's Eau de 3.4 fl oz/100ml,Cologne,86.99,3.0,Available,7,United States,2024-05-08 16:32:50.000,Prezzo Alto,608.93
women,Jo Malone,Jo Malone Velvet Rose & Oud Cologne Intense Women's Eau de 3.4 fl oz/100ml,Cologne,86.99,4.0,Available,6,United States,2024-05-08 16:32:50.000,Prezzo Alto,521.9399999999999
women,Jo Malone,Jo Malone Wood Sage & Sea Salt 1 fl oz No Box Eau de Cologne Spray Regular Size,Cologne,34.99,3.0,Available,12,United States,2024-05-24 03:51:06.000,Prezzo Medio,419.88
women,Hermès,Jour D'hermes by Hermes EDP for Women 2.87 oz / 85 ml *NEW IN SEALED BOX*,Eau de Parfum,64.99,10.0,Available,123,United States,2024-02-08 12:24:00.000,Prezzo Medio,7993.7699999999995
women,Jovan,JOVAN MUSK by COTY Perfume 3.25 oz New in Box,Cologne,11.94,82.0,Available,1286,United States,2024-05-24 01:00:38.000,Prezzo Basso,15354.84
women,Jovan,Jovan Musk for Women Cologne 3.25 oz - Classic Scent Spray,Cologne,11.99,,Unknown,58,United States,2024-05-06 23:34:08.000,Prezzo Basso,695.42
women,Juicy Couture,Juicy Couture By Juicy Couture Eau De Parfum Spray  Perfume Authentic 1 oz,Eau de Parfum,14.99,10.0,Available,5,United States,2024-04-12 12:50:40.000,Prezzo Basso,74.95
women,Juicy Couture,JUICY COUTURE SOLID PERFUME STICK for Women 0.17 oz Mini NEW Free Ship,Parfum,5.65,6.0,Available,178,United States,2024-05-19 21:05:55.000,Prezzo Basso,1005.7
women,Juicy Couture,JUICY COUTURE DUO: VIVA LA JUICY W EDP  / VIVA LA JUICY GOLD COUTURE W EDP (5ML),Eau de Parfum,12.0,8.0,Available,10,United States,2024-05-20 09:31:24.000,Prezzo Basso,120.0
women,Juliette Has A Gun,Juliette Has A Gun Discovery Kit includes LUST for sun SEALED new,Eau de Parfum,26.05,10.0,Available,128,United States,2024-05-19 15:38:07.000,Prezzo Basso,3334.4
women,Juliette Has A Gun,Juliette Has A Gun Not a Perfume Eau De Parfum 3.3 fl. oz / 100 ml Spray Women,Eau de Parfum,55.1,,Unknown,39,United States,2024-05-24 06:11:53.000,Prezzo Medio,2148.9
women,Juliette Has A Gun,Juliette Has A Gun Not A Perfume Eau De Parfum 5 ml .17 fl oz Travel Size NEW,Eau de Parfum,11.66,2.0,Available,12,United States,2024-05-15 21:40:55.000,Prezzo Basso,139.92000000000002
women,Juliette Has A Gun,Juliette Has a Gun Not a Perfume Womens EDP Travel Size 5.5 ML / 0.17 oz NWOB,Eau de Parfum,11.99,10.0,Available,19,United States,2024-04-11 12:26:20.000,Prezzo Basso,227.81
women,Juliette Has A Gun,"Juliette Has a Gun PEAR INC. 1.7 oz. Eau de Parfum Spray, New in Sealed Box",Eau de Parfum,54.95,10.0,Available,18,United States,2024-05-23 13:41:41.000,Prezzo Medio,989.1
women,Huda Beauty Kayali,KAYALI EDEN SPARKLING LYCHEE | 39 Eau de Parfum 0.34 oz SEALED MADE IN FRANCE,Eau de Parfum,42.0,4.0,Available,11,United States,2024-05-22 11:38:02.000,Prezzo Medio,462.0
women,Huda Beauty,kayali vanilla candy rock sugar | 42 HUDA BEAUTY Sample 1.5ml on card New,Eau de Parfum,14.95,,Unknown,17,United States,2024-05-23 13:54:40.000,Prezzo Basso,254.14999999999998
women,Kenzo,Kenzo Amour by Kenzo EDP For Women Spray 3.3 oz / 100 ml *NEW IN BOX*,Eau de Parfum,39.99,10.0,Available,102,United States,2024-05-08 10:56:21.000,Prezzo Medio,4078.98
women,Kenzo,Kenzo Jungle Elephant by Kenzo EDP For Women 3.4 oz / 100 ml *NEW IN BOX*,Eau de Parfum,38.99,10.0,Available,57,United States,2024-05-08 10:46:42.000,Prezzo Medio,2222.4300000000003
women,Khadlaj,Khadlaj Hareem Al Sultan Gold Concentrated Oil Perfume 35 ml Women Spray,Parfum,25.99,10.0,Available,49,United States,2024-05-22 20:08:27.000,Prezzo Basso,1273.51
women,Kilian,Kilian Angels' Share Eau De Parfum Sample Spray Vial 1.5ml / 0.05oz,Eau de Parfum,7.99,10.0,Available,333,United States,2024-04-10 17:57:58.000,Prezzo Basso,2660.67
women,Kilian,Kilian Paris Can't Stop Loving You 50ml/ 1.7oz EDP New & Sealed,Eau de Parfum,100.0,,Unknown,12,United States,2024-05-20 18:17:12.000,Prezzo Alto,1200.0
women,Kilian,"KILIAN Paris Can't Stop Loving You Full Size 1.7oz/50mL, New in Sealed Box",Eau de Parfum,100.99,,Unknown,15,United States,2024-05-16 03:17:16.000,Prezzo Alto,1514.85
women,Kim Kardashian,KIM KARDASHIAN GOLD Perfume 3.3 / 3.4 oz EDP For Women NEW IN BOX,Eau de Parfum,16.63,37.0,Available,528,United States,2024-05-14 12:55:23.000,Prezzo Basso,8780.64
women,Kim Kardashian,Kim Kardashian True Reflection Eau De Parfum Spray. Perfume for Women. 1 fl.oz,Eau de Parfum,9.49,5.0,Available,491,United States,2024-05-23 13:11:55.000,Prezzo Basso,4659.59
women,Estée Lauder,Knowing by Estee Lauder 2.5 oz EDP Perfume for Women New In Box,Eau de Parfum,42.69,10.0,Available,868,United States,2024-05-23 08:22:07.000,Prezzo Medio,37054.92
women,L'Artisan,L'Artisan Parfumeur 'Mon Numero 10' Eau de Parfum 0.7oz/30ml New In Box,Eau de Parfum,48.93,10.0,Available,37,United States,2024-05-18 08:18:46.000,Prezzo Medio,1810.41
women,Al Haramain,L'aventure Ciel by Al Haramain Eau De Parfum 3.33oz/100ml Spray New With Box,Eau de Parfum,33.75,10.0,Available,10,United States,2024-05-23 16:06:10.000,Prezzo Medio,337.5
women,Issey Miyake,L'eau D'Issey by Issey Miyake EDT Perfume for Women 1.6 oz New In Box,Eau de Toilette,31.87,6.0,Available,258,United States,2024-05-23 16:28:06.000,Prezzo Medio,8222.460000000001
women,,L'Imperatrice 3 by D&G 3.3 oz 100ml Eau de Toilette Perfume for Women New In Box,Eau de Toilette,32.99,4.0,Available,14,Hong Kong,2024-05-24 10:01:28.000,Prezzo Medio,461.86
women,Dolce & Gabbana,L'Imperatrice by Dolce & Gabbana D&G 3.3 / 3.4 oz EDT Perfume for Women NIB,Eau de Toilette,39.98,,Unknown,3379,United States,2024-05-23 18:40:58.000,Prezzo Medio,135092.41999999998
women,Givenchy,L'Interdit by Givenchy Eau De Toilette For Women 2.6 oz / 80 ml *NEW*,Eau de Toilette,41.99,10.0,Available,39,United States,2024-05-08 10:37:27.000,Prezzo Medio,1637.6100000000001
women,Givenchy,L'Interdit Intense Rouge by Givenchy perfume for women EDP 2.7 oz New Tester,Eau de Parfum,63.25,86.0,Available,116,United States,2024-05-18 00:20:14.000,Prezzo Medio,7337.0
women,Gwen Stefani,L Lamb By Gwen Stefani Perfume Women 3.4 oz 100ML EDP Spray (T) Very Rare!,Eau de Parfum,150.0,,Unknown,62,United States,2024-05-11 01:54:01.000,Prezzo Alto,9300.0
women,Gwen Stefani,L.A.M.B by Gwen Stefani LAMB perfume 0.17 oz / 5 ml EDP for Women,Eau de Parfum,28.99,6.0,Available,42,United States,2024-05-14 19:07:16.000,Prezzo Basso,1217.58
women,Generic,LA VIDA BELLA POUR FEMME EAU DE PARFUM SPRAY FOR WOMEN 3.4 Oz / 100 ml BRAND NEW,Eau de Parfum,10.99,10.0,Available,29,United States,2024-05-15 03:09:07.000,Prezzo Basso,318.71
women,Lancôme,La Vie Est Belle By Lancôme 2.5 OZ L'Eau De Parfum For Women,Eau de Parfum,37.99,10.0,Available,77,United States,2024-05-08 14:25:33.000,Prezzo Medio,2925.23
women,Lancôme,La Vie Est Belle By Lancome 3.4 Fl oz Spray Eau De Parfum Women's New & Sealed,Eau de Parfum,41.49,,Unknown,61,United States,2024-05-24 03:14:22.000,Prezzo Medio,2530.8900000000003
women,Lancôme,"La Vie Est Belle by Lancome 3.4 Oz – Women's L'eau De Parfum, Sealed Freshness",Eau de Parfum,49.99,5.0,Available,127,United States,2024-05-21 07:49:52.000,Prezzo Medio,6348.7300000000005
women,Lancôme,Lancome Tresor Women's EDP 3.4 oz Spray,Eau de Parfum,42.99,10.0,Available,17,United States,2024-05-17 10:07:21.000,Prezzo Medio,730.83
women,Lancôme,La Vie Est Belle by Lancome 3.4 oz / 100 ml Spray L'Eau De Parfum New & Sealed,Eau de Parfum,42.99,2.0,Available,146,United States,2024-05-24 07:08:11.000,Prezzo Medio,6276.54
women,Lancôme,La Vie Est Belle by Lancome 3.4 oz 100 ml L'Eau De Parfum BRAND NEW SEALED BOX,Eau de Parfum,69.99,9.0,Available,25,United States,2024-05-09 03:18:01.000,Prezzo Medio,1749.7499999999998
women,Lancome,La Vie Est Belle by Lancome Paris 2.5 fl oz EDP Perfume for Women New In Box,Eau de Parfum,37.99,10.0,Available,517,United States,2024-05-23 08:08:10.000,Prezzo Medio,19640.83
women,Lancôme,La Vie Est Belle INTENSEMENT by Lancome EDP for Women 3.4 oz /100ml *NEW IN BOX*,Eau de Parfum,74.99,10.0,Available,160,United States,2024-02-14 12:25:07.000,Prezzo Medio,11998.4
women,Lancôme,La Vie Est Belle IRIS ABSOLU by Lancome 3.4 oz L'Eau de Parfum Spray New In Box,Eau de Parfum,61.99,4.0,Available,49,Hong Kong,2024-05-19 01:35:33.000,Prezzo Medio,3037.51
women,Paco Rabanne,LADY MILLION Paco Rabanne for women perfume EDP 2.7 oz NEW TESTER,Eau de Parfum,50.73,105.0,Available,1905,United States,2024-05-15 16:35:07.000,Prezzo Medio,96640.65
women,Lake&Skye,Lake & Skye 11 11 Eau De Parfum 3.4oz  (WITHOUT BOX),Eau de Parfum,99.99,2.0,Available,3,United States,2024-05-23 20:28:37.000,Prezzo Alto,299.96999999999997
women,Lancome,Lancome Idole Le Parfum  Spray  25ML/0.8 fl OZ New In Box,Eau de Parfum,26.99,10.0,Available,44,United States,2024-05-17 19:59:50.000,Prezzo Basso,1187.56
women,Lancôme,Lancome Idole Now 3.4oz / 100ml Eau De Parfum Spray For Women New In Box,Eau de Parfum,69.99,4.0,Available,23,Hong Kong,2024-05-09 00:05:00.000,Prezzo Medio,1609.77
women,Lancôme,Lancome La Vie Est Belle 3.4 oz EDP Women's Fragrance Perfume Spray Sealed,Eau de Parfum,49.99,8.0,Available,53,United States,2024-05-10 09:52:59.000,Prezzo Medio,2649.4700000000003
women,Lancôme,Lancome LA VIE EST BELLE Eau de Parfum EDP Perfume 4ml Splash Mini Bottle NWOB,Eau de Parfum,7.95,10.0,Available,162,United States,2024-05-22 22:50:14.000,Prezzo Basso,1287.9
women,Lancôme,Lancome La Vie Est Belle EDP - Irresistible Gourmand 3.4oz Sealed,Eau de Parfum,49.99,6.0,Available,10,United States,2024-05-23 09:45:31.000,Prezzo Medio,499.90000000000003
women,Lancôme,"Lancome La Vie Est Belle Little Luxuries Set Parfum,Lotion,Gloss,Blush $55 Value",Parfum,15.0,10.0,Available,7,United States,,Prezzo Basso,105.0
women,Lancôme,Lancome Tresor - Romantic 3.4oz Eau de Parfum Spray for Women,Eau de Parfum,43.99,6.0,Available,15,United States,2024-05-17 09:27:23.000,Prezzo Medio,659.85
women,Lancôme,Lancome Tresor 3.4 oz EDP | Classic Women's Perfume Spray | New in Box,Eau de Parfum,42.99,10.0,Available,20,United States,2024-05-21 10:57:12.000,Prezzo Medio,859.8000000000001
women,Lancôme,Lancome Tresor 3.4 oz EDP Romantic & Sophisticated for Women New,Eau de Parfum,44.99,5.0,Available,14,United States,2024-05-08 07:48:32.000,Prezzo Medio,629.86
women,Lancôme,Lancome Tresor 3.4 oz EDP Romantic Women's Perfume Spray Timeless Fragrance,Eau de Parfum,44.99,10.0,Available,9,United States,2024-05-23 08:27:40.000,Prezzo Medio,404.91
women,Lancôme,Lancome Tresor 3.4oz EDP Women's Elegant Perfume Spray New,Eau de Parfum,43.99,10.0,Available,29,United States,2024-05-21 09:06:40.000,Prezzo Medio,1275.71
women,Lancôme,Lancôme Tresor 3.4oz Women's EDP Classic Fragrance New Sealed,Eau de Parfum,43.99,6.0,Available,15,United States,2024-05-18 10:27:17.000,Prezzo Medio,659.85
women,Lancôme,Lancome Tresor EDP 3.4 oz Timeless Women's Perfume Spray New in Box,Eau de Parfum,43.99,6.0,Available,52,United States,2024-05-24 08:49:27.000,Prezzo Medio,2287.48
women,Lancôme,Lancome Tresor Women Eau de Parfum 3.4 oz 100 ml New Sealed in Box,Eau de Parfum,43.99,10.0,Available,40,United States,2024-05-17 10:16:14.000,Prezzo Medio,1759.6000000000001
women,Lattafa,Lattafa Fakhar EDP Spray 3.4 oz / 100 ml for Men,Eau de Parfum,23.25,10.0,Available,19,United States,2024-05-24 11:15:06.000,Prezzo Basso,441.75
women,Lattafa,Lattafa Ladies Haya EDP 3.4 oz Fragrances 6291108738504,Other,34.77,3.0,Available,9,United States,2024-05-23 08:44:45.000,Prezzo Medio,312.93
women,Lattafa Perfumes,"Lattafa Perfumes Mayar EDP - Eau De Parfum Women 100ml(3.4 oz) | Lychee, white f",Eau de Parfum,26.99,6.0,Available,155,United States,2024-05-23 14:23:52.000,Prezzo Basso,4183.45
women,,Lattafa YARA by Lattafa 3.4 Oz (100 ml) EDP Eau De Parfum Spray for Women.,Eau de Parfum,16.27,300.0,Available,38,China,2024-05-24 08:20:15.000,Prezzo Basso,618.26
women,Lattafa,Lattafa Yara Women's Floral Perfume 5mL Samples Long Lasting Sweet,Parfum,9.99,7.0,Available,13,United States,,Prezzo Basso,129.87
women,Armaf,Le Femme by Armaf perfume for women EDP 3.3 / 3.4 oz New in Box,Eau de Parfum,20.71,100.0,Available,290,United States,2024-05-23 21:14:09.000,Prezzo Basso,6005.900000000001
women,Le Labo,"Le Labo Another 13 Eau de Parfum EDP Sample Vial .025oz, .75ml New in Pouch",Eau de Parfum,13.89,5.0,Available,52,United States,2024-05-24 00:31:53.000,Prezzo Basso,722.28
women,Le Labo,Le Labo Santal 33 Eau de Parfum Sample Spray Vial .05 oz /1.5 ml  New authentic,Eau de Parfum,14.75,10.0,Available,119,United States,2024-04-26 15:10:49.000,Prezzo Basso,1755.25
women,Yves Saint Laurent,Libre by Yves Saint Laurent Eau de Parfum Spray 3 fl oz for Women New In Box,Eau de Parfum,49.99,5.0,Available,25,Hong Kong,2024-05-17 10:03:27.000,Prezzo Medio,1249.75
women,Yves Saint Laurent,Libre By Yves Saint Laurent for Women EDT 1.6 oz / 50 ml *NEW IN SEALED BOX*,Eau de Toilette,53.99,10.0,Available,137,United States,2024-05-08 11:04:40.000,Prezzo Medio,7396.63
women,Yves Saint Laurent,Libre By Yves Saint Laurent for Women EDT 3 oz / 90 ml *NEW IN SEALED BOX*,Eau de Parfum,59.96,4.0,Available,19,Hong Kong,2024-05-19 00:50:26.000,Prezzo Medio,1139.24
women,Ysl,Libre by Yves Saint Laurent YSL 3 oz EDP Perfume for Women New in Box,Eau de Parfum,54.95,,Unknown,25,United States,2024-05-24 00:08:02.000,Prezzo Medio,1373.75
women,Yves Saint Laurent,LIBRE By Yves Saint Laurent YSL Eau de Parfum EDP Perfume 3 Oz/90ML for Women,Eau de Parfum,49.99,5.0,Available,6,United States,,Prezzo Medio,299.94
women,,LIBRE By Yves Saint Laurent YSL Eau de Parfum EDP Perfume 3 Oz/90ML for Women,Eau de Parfum,59.99,10.0,Available,114,United States,2024-05-17 21:05:23.000,Prezzo Medio,6838.860000000001
women,Yves Saint Laurent,"Libre, Eau De Parfum Intense By Yves Saint Laurent 3oz for Women NEW",Eau de Parfum,98.99,3.0,Available,56,United States,2024-04-24 01:25:42.000,Prezzo Alto,5543.44
women,Dolce&Gabbana,Light Blue 3.3 oz by Dolce & Gabbana EDT Perfume for Women New In Box & SEALED,Eau de Toilette,30.95,8.0,Available,245,United States,2024-05-24 05:48:01.000,Prezzo Medio,7582.75
women,Five Star Fragrance,Light Blue 6.7 oz / 200mL Women's Eau De Toilette Spray Perfume Brand New Sealed,Eau de Toilette,40.99,10.0,Available,14,United States,2024-05-21 09:18:50.000,Prezzo Medio,573.86
women,Dolce&Gabbana,Light Blue by Dolce & Gabbana 3.3 / 3.4 oz EDT Perfume for Women New In Box,Eau de Toilette,29.65,6.0,Available,821,United States,2024-05-23 00:37:02.000,Prezzo Basso,24342.649999999998
women,Dolce&Gabbana,Light Blue by Dolce & Gabbana 3.3 oz / 3.4 oz 100mL EDT Spray Brand New Sealed,Eau de Toilette,29.95,10.0,Available,296,United States,2024-05-24 10:55:00.000,Prezzo Basso,8865.199999999999
women,Dolce&Gabbana,Light Blue by Dolce & Gabbana 3.3 oz Women's Eau de Toilette Spray New & Sealed,Eau de Toilette,32.49,10.0,Available,226,United States,2024-05-24 08:10:07.000,Prezzo Medio,7342.740000000001
women,Dolce & Gabbana,Light Blue by Dolce & Gabbana D&G 3.3 / 3.4 oz EDT Perfume for Women New In Box,Eau de Toilette,43.3,,Unknown,4845,United States,2024-05-21 07:54:03.000,Prezzo Medio,209788.5
men,Prada,Prada L'Homme 3.4 oz EDT Cologne for Men New In Box,Eau de Toilette,86.87,,Unknown,322,United States,2024-05-23 20:20:11.000,Prezzo Alto,27972.140000000003
women,Dolce&Gabbana,Light Blue by Dolce & Gabbana for women EDT 3.3 / 3.4 oz SEALED NEW,Eau de Toilette,28.85,7.0,Available,82,United States,2024-05-22 10:10:34.000,Prezzo Basso,2365.7000000000003
